{
  "$schema": "../task.schema.json",
  "schema_version": 2,
  "id": "nf-primality-proof-resume",
  "title": "Nf Primality Proof Resume",
  "lane": "arithmetic-algebra",
  "status": "active",
  "owner": "user",
  "objective": "Complete deterministic resumable arbitrary-size primality proofs and branch-local split state",
  "base_commit": "86184c56f978519ed9ded3814adc54530944167f",
  "claims": [
    "src/lib/sagejs/number_fields/discriminant_components.py",
    "src/lib/sagejs/number_fields/maximal_order_certification.py",
    "test/number-field-discriminant-components.cjs",
    "test/fixtures/number-field-maximal-order-components.json"
  ],
  "dependencies": [],
  "references": [],
  "architecture": {
    "strategy": "dynamic-python",
    "fallback": "same-source",
    "oracles": [
      "sage"
    ],
    "exceptions": []
  },
  "platforms": {
    "linux-x64": "required",
    "linux-arm64": "required",
    "windows-x64": "required",
    "macos-arm64": "required"
  },
  "validation": [
    "pnpm test:baselib:strict",
    "node --test test/number-field-discriminant-components.cjs",
    "pnpm test:native"
  ],
  "runs": [
    {
      "command": "pnpm test:baselib:strict",
      "result": "pass",
      "exit_code": 0,
      "seconds": 19.548,
      "started_at": "2026-08-17T21:36:32.617Z",
      "commit": "86184c56f978519ed9ded3814adc54530944167f",
      "workspace_fingerprint": "47e75493fcb211e41a3bd23d25ecc3dad722c4098b9436e5cda2eb6f8cc624e0",
      "platform": "linux-x64"
    },
    {
      "command": "node --test test/number-field-discriminant-components.cjs",
      "result": "pass",
      "exit_code": 0,
      "seconds": 87.629,
      "started_at": "2026-08-17T21:36:56.742Z",
      "commit": "86184c56f978519ed9ded3814adc54530944167f",
      "workspace_fingerprint": "47e75493fcb211e41a3bd23d25ecc3dad722c4098b9436e5cda2eb6f8cc624e0",
      "platform": "linux-x64"
    }
  ],
  "handoff": {
    "summary": "Added deterministic resumable Pocklington proof checkpoints, exact resource receipts, fair probable-branch splitting, fail-closed independent validators, and branch-local decomposition replacement APIs. Exact PARI vectors 168, 250, 285, 314, and 365 are certified in CPython and Sage.js.",
    "risks": [
      "Completion requires callers to resume with positive work budgets and a recursion-depth limit large enough for the input; exhaustion is explicitly non-proof evidence.",
      "Broad test:changed reaches unrelated inherited local_polygons boundary and missing optional FLINT/native-cache failures; focused pure-Python checks pass."
    ],
    "next_steps": [
      "Integrate the exported proof and branch-local certification helpers into the public maximal-order engine.",
      "Rerun the five-case corpus sweep with the proof completion budget."
    ]
  }
}
