{
  "$schema": "../task.schema.json",
  "schema_version": 2,
  "id": "cubic-analytic-schedule",
  "title": "Cubic Analytic Schedule",
  "lane": "arithmetic-algebra",
  "status": "active",
  "owner": "user",
  "objective": "Correct the native BF ninth-scale proof contract and measure general analytic-cutoff schedules without weakening certification or resource limits",
  "base_commit": "d3a5973b417e7e6aab1223a25ecb585dcf524acb",
  "claims": [
    "src/lib/sagejs/number_fields/cubic_class_number_native.py",
    "bench/class-unit-groups/cubic-analytic-schedule.cjs",
    "bench/class-unit-groups/cubic-bf-scale-audit.py",
    "test/cubic-analytic-schedule.cjs",
    "docs/cubic-analytic-schedule.md",
    "docs/complex-cubic-native-class-group-proof.md",
    "test/number-field-cubic-bf-prefix.cjs",
    "test/number-field-cubic-native-class-number.cjs",
    "test/fixtures/cubic-reconstructed-regulator-guard.py",
    "test/fixtures/cubic-analytic-suffix.py"
  ],
  "dependencies": [],
  "references": [
    "https://www.math.u-bordeaux.fr/~kbelabas/research/residue-arxiv.pdf",
    "https://github.com/sagemathinc/sagejs/pull/203"
  ],
  "architecture": {
    "strategy": "source-transparent-native",
    "fallback": "same-source",
    "oracles": [
      "cpython",
      "pari",
      "javascript"
    ],
    "exceptions": []
  },
  "platforms": {
    "linux-x64": "required",
    "linux-arm64": "required",
    "windows-x64": "required",
    "macos-arm64": "required"
  },
  "validation": [
    "pnpm test:baselib:strict",
    "pnpm test:native"
  ],
  "runs": [
    {
      "command": "node --test test/cubic-analytic-schedule.cjs",
      "result": "pass",
      "exit_code": 0,
      "seconds": 2.653,
      "started_at": "2026-09-09T10:29:56.274Z",
      "commit": "8d37c8a2e96c0da86baa967084c2d5b91ca65d18",
      "workspace_fingerprint": "16d7fb5678e4764265053a83cf6ef243ef48059a5afe43c7d37ef223b3919dc8",
      "platform": "linux-x64"
    },
    {
      "command": "node --test test/cubic-analytic-schedule.cjs",
      "result": "pass",
      "exit_code": 0,
      "seconds": 2.685,
      "started_at": "2026-09-09T10:51:01.083Z",
      "commit": "8d37c8a2e96c0da86baa967084c2d5b91ca65d18",
      "workspace_fingerprint": "849a92413e5b606788947fd1f1ec40ac5911a02b73571996ee6cf97fbb20315b",
      "platform": "linux-x64"
    },
    {
      "command": "node --test test/cubic-analytic-schedule.cjs",
      "result": "pass",
      "exit_code": 0,
      "seconds": 2.687,
      "started_at": "2026-09-09T11:11:54.471Z",
      "commit": "ef27002bbc0e42b7b769658f30b06085487d7690",
      "workspace_fingerprint": "5234842d019730c6da6a24f849358561f4f5f14720e5d21a6e725c6f2344497f",
      "platform": "linux-x64"
    }
  ],
  "handoff": {
    "summary": "PR203 production BF-999 scale correction remains unchanged. Separate partial-prime native helper passes 800 rational cases, 20 faults, 818 compiled cases per backend, and complete 1012-field three-backend agreement. Controlled full-corpus timing rejects cutoff513: 2.60% aggregate regression despite small-panel gain. More importantly, exact specialization audit finds the printed Theorem7 constants at sigma=3/2 do not yield printed Corollary8 coefficients 3.35 and 0.619. Both preprint and published version checked. Suspend certification/promotion claims for all Corollary8 experiments pending derivation; use stronger-search Theorem1/BF999 as supported baseline. Not a counterexample to the corollary or an observed wrong class group.",
    "risks": [
      "Optimizer-opportunity inventory is already stale at the baseline; architecture gate not passing.",
      "Final broad test:changed run is terminal failure: 74 full-tier files passed, then five FFI failures from missing FFLAS manifest/igraph addon/static library; 509 files not started. Fresh build and all192 unit files passed. Do not restart an old handle or claim the full585 tier passed.",
      "Full-corpus independent replay and four-platform release qualification remain outstanding; PR remains draft.",
      "Corollary-8 source copies are experiments, not production changes or public receipt qualification. Sources and evidence are retained under ignored build/cubic-analytic-schedule-evidence.",
      "The Corollary8 citation no longer closes the proof audit: direct exact Theorem7 specialization requires upper constant 5.35 and lower real-place coefficient 0.429, rather than printed 3.35/0.619. Explain a missing stronger estimate or replace with a directly derived bound before promotion. Production Theorem1 scale correction unaffected."
    ],
    "next_steps": [
      "Finish integration/release review of the narrow scale fix separately from new residue-bound work.",
      "Resolve the Corollary8 specialization gap before any new bound promotion. Exact rational audit and both paper versions retained; a published theorem citation plus matching formula tests is not sufficient to explain the discovered coefficient discrepancy.",
      "Retained raw-relation forensics rechecked: the original failed search kernel yields only torsion units. Existing initial-volume/BF-lookup source already fixes this missing-relation regime; do not reimplement it from the older production baseline.",
      "Preserve stronger-search BF999 gains while consolidating duplicated proof orchestration; keep the 485000 source allowance unchanged. Corollary8 source-copy measurements remain historical unqualified diagnostics, not public replay qualification.",
      "Partial-prime implementation and tests now exist in retained experiments. Do not promote cutoff513 based on the 17-field gain: all1012 controlled timing is 2.60% slower, with 180 final refinements. Refinement rebuilds prime splitting and transcendental endpoints; correct reuse must admit higher-degree norms of old small primes and reweight all finite terms.",
      "Direct Theorem7 replacement at765 is implemented in source copy 6fa3fe31efdbb01e9c147fbc98e930cfefdf04698067eb9d344ab9fd01e2475e: 800 exact formula checks, 20 faults, complete1012-field fmpz/GMP/JavaScript agreement, 963 first-effort successes. Full computation timing completes1012/1012 with no mismatches and 0.63% aggregate improvement over stronger-search BF999, still2.86x PARI. Not a durable speedup or release qualification; source+runtime526816 exceeds unchanged485000 cap.",
      "Fourteen-factor forensics completed: exact principal-ideal replay and bnfcertify show effort5 raw36-row quotient has order6 and unit index1; effort1 raw46-row quotient has order3 and unit index1. Retry row36, generator(a^2-9a-106)/7, closes the missing relation index. This witness is diagnostic only, never a hardcoded production rule. PARI trace starts at tentative h12 then uses ideal-product searches to reach6,6,3.",
      "Ordering16 ablation has8 gains/8 losses on1012; staged16 has10 gains/5 losses. All64 output words agree fmpz/GMP/JavaScript on256 affected-regime fields. Controlled18-field opt panel: target9.637ms baseline to3.339ms staged versusPARI1.406; panel aggregate improves but several regressions. Not a general performance or public-replay qualification.",
      "Round-robin volume16 source d3e32776889299c5a89125007414eedb410ed08a91e4c6090dda3ba86711a16d accepts979/1012,18 gains and2 losses, recovering all5 staged16 losses. Both remaining losses reproducibly exhaust the unchanged3MiB temporary arena on large-unit fields3.1.16355768.1 and3.1.16912280.1. Investigate temporary lifetimes/repeated certification before promotion; do not raise limits or treat partially written exceptional diagnostics as unit certificates. Sources, exact oracles, surveys and timing retained under build/cubic-analytic-schedule-evidence/fourteen-factor."
    ]
  }
}
