{
  "$schema": "../task.schema.json",
  "schema_version": 2,
  "id": "torsion-authority",
  "title": "Real cubic torsion authority",
  "lane": "arithmetic-algebra",
  "status": "active",
  "owner": "torsion_authority",
  "objective": "Implement and replay exact torsion authority for the authentic real cubic h=1 sentinel from prepared neutral field data, including maximality and mutation tests",
  "base_commit": "051cc39a1816a4032164000c4a8510c3774b6758",
  "claims": [
    "bench/pari-class-group-port/torsion_authority.py",
    "bench/pari-class-group-port/check_torsion_authority.cjs",
    "bench/pari-class-group-port/torsion_authority_audit.md"
  ],
  "dependencies": [],
  "references": [],
  "architecture": {
    "strategy": "dynamic-python",
    "fallback": "same-source",
    "oracles": [
      "Exact cubic discriminant, rational-root irreducibility, and multiplication-table replay",
      "PARI 2.17.4 nfrootsof1 on the pinned sentinel"
    ],
    "exceptions": []
  },
  "platforms": {
    "linux-x64": "required",
    "linux-arm64": "required",
    "windows-x64": "not-applicable",
    "macos-arm64": "required"
  },
  "validation": [
    "pnpm test:baselib:strict",
    "pnpm test:native"
  ],
  "runs": [
    {
      "command": "node bench/pari-class-group-port/check_torsion_authority.cjs --pari-gp /scratch/sagejs-runtime/pari-class-group-e2e-20260916/toolchains/src/pari-2.17.4-phase0/Olinux-x86_64/gp-dyn",
      "result": "pass",
      "exit_code": 0,
      "seconds": 0.118,
      "started_at": "2026-09-17T02:20:01.868Z",
      "commit": "051cc39a1816a4032164000c4a8510c3774b6758",
      "workspace_fingerprint": "52898eae9056ed6e233729375a82eac3bb972303ed6dc121ab74565b8a1a076d",
      "platform": "linux-x64"
    }
  ],
  "handoff": {
    "summary": "Added a standalone exact roots-of-unity authority for the authentic totally real cubic sentinel. It consumes only the prepared defining polynomial, proves cubic irreducibility and three real embeddings, verifies -1 has exact order two and norm -1 in the quotient algebra, proves maximality through an injective real embedding, and seals all claims behind field-pinned detached replay. The focused checker rejects coordinated rehashed mutations and agrees with private PARI 2.17.4 nfrootsof1=[2,-1].",
    "risks": [
      "This intentionally narrow authority covers irreducible monic totally real cubics; non-real fields need the general cyclotomic/root-of-unity path.",
      "The full test:changed run was stopped during its broad repository build at integration-owner request; focused syntax, Ruff format, contract, mutation, and private-PARI checks pass."
    ],
    "next_steps": [
      "Integrate the returned torsion record into the authentic final result without weakening the separate unit, regulator, relation, or public-completeness gates."
    ]
  }
}
